{
  "descriptor_type": "cawg-trqp-feed-descriptor",
  "descriptor_version": "1.0.0",
  "descriptor_id": "urn:trqp:feed-descriptor:snapshot:2026-q1",
  "issued_at": "2026-04-27T00:00:00Z",
  "valid_until": "2027-04-27T00:00:00Z",
  "authority": {
    "authority_id": "did:web:media-registry.example",
    "key_id": "media-registry-snapshot-key-1",
    "scope": [
      "cawg:news-content",
      "vc:creator-identity"
    ]
  },
  "feed": {
    "feed_type": "snapshot_feed",
    "content_type": "application/json",
    "source": "data/snapshot.json",
    "digest_alg": "sha-256",
    "digest_sha256": "6286e9a028f5093bd2ebd41db8c07db45bcfd5e0f04a518f07404e5bda03d765",
    "policy_epoch": "2026-Q1"
  },
  "freshness": {
    "max_age_seconds": 86400,
    "enforcement": "fail"
  },
  "route": {
    "channel": "https",
    "attested": true,
    "route_label": "snapshot-feed",
    "gateway_id": "gateway:reference"
  },
  "descriptor_signature": {
    "algorithm": "Ed25519",
    "key_id": "media-registry-snapshot-key-1",
    "value": "6ddxpatBmnPDVS5rfeZv5uABWr7XF+9BR5pxIxNYTtTPnNYIKkbs8FcFTrNe2jnelywtJto5djVGKqspxyLtDQ=="
  }
}
